{
  "report_id": "rep-901",
  "reported_indicator": "UPI_VPA",
  "report_category": "QR_SCAM",
  "description": "Scammer sent a QR code claiming I will receive money, but it was a payment request.",
  "evidence_references": ["evid-qr-4"],
  "submission_timestamp": "2026-08-14T10:00:00Z",
  "moderation_status": "PENDING",
  "confidence": 0.9,
  "provenance": "USER_SUBMISSION"
}
